{
  "schema": "legion.attempt.v1",
  "attempt_id": "attempt-2",
  "attempt_kind": "provider",
  "run_id": "run-1",
  "parent_attempt_id": "parent-1",
  "ordinal": 2,
  "executor": "fixture",
  "provider": "fixture-provider",
  "config_identity": "config-sha256",
  "requested_model": "fixture-model",
  "effective_model": "fixture-model",
  "requested_effort": null,
  "effective_effort": null,
  "cache_lineage": {"preflight_cache_key": "cache-1", "previous_attempt_id": "attempt-1"},
  "usage": null,
  "usage_status": "unknown",
  "usage_source": null,
  "cost_usd": null,
  "cost_status": "unknown",
  "cost_source": null,
  "failure": null,
  "output_started": true,
  "started_at": "2026-09-10T00:00:01Z",
  "ended_at": "2026-09-10T00:00:02Z",
  "duration_ms": 1000,
  "sandbox": "workspace-write",
  "terminal_status": "succeeded",
  "child_attempt_ids": [],
  "reconciliation": null
}
