{
  "schema": "legion.attempt.v1",
  "attempt_id": "attempt-1",
  "attempt_kind": "provider",
  "run_id": "run-1",
  "parent_attempt_id": "parent-1",
  "ordinal": 1,
  "executor": "fixture",
  "provider": "fixture-provider",
  "config_identity": "config-sha256",
  "requested_model": "fixture-model",
  "effective_model": "fixture-model",
  "requested_effort": "high",
  "effective_effort": "high",
  "cache_lineage": {"preflight_cache_key": "cache-1", "previous_attempt_id": null},
  "usage": {"input_tokens": 10, "output_tokens": 3},
  "usage_status": "known",
  "usage_source": "provider-json",
  "cost_usd": 0.25,
  "cost_status": "known",
  "cost_source": "provider-json",
  "failure": null,
  "output_started": true,
  "started_at": "2026-09-10T00:00:00Z",
  "ended_at": "2026-09-10T00:00:01Z",
  "duration_ms": 1000,
  "sandbox": "workspace-write",
  "terminal_status": "succeeded",
  "child_attempt_ids": [],
  "reconciliation": null
}
